{
  "schema_version": "1.0",
  "gate_track_receipt_id": "gtr_passdet0001",
  "workspace_id": "ws_stage0001",
  "case_id": "case_stage0001",
  "gate_execution_id": "gexec_stage0001",
  "resolution_contract": {
    "kind": "RESOLUTION_CONTRACT",
    "id": "rc_stage0001",
    "revision": 1,
    "digest": "sha256:cc97aa93105ee1337bcdb5ae708c77c1c35be887bdc67aac270692b5e9883d83"
  },
  "candidate_contract": {
    "kind": "CANDIDATE_CONTRACT",
    "id": "cc_stage0001",
    "revision": null,
    "digest": "sha256:68c1db5e06b8af0343e2e83b3f7abbbc5ddbd9ceebc67435d6734fa19986039b"
  },
  "candidate_revision": {
    "kind": "CANDIDATE_REVISION",
    "id": "crev_stage0001",
    "revision": 1,
    "digest": "sha256:6ac8562ff1059fd102ef1e2362c2f3cd0ee6575d6a51ba6bd431d73996fefc8a"
  },
  "evaluation_plan": {
    "kind": "EVALUATION_PLAN",
    "id": "eplan_stage0001",
    "revision": null,
    "digest": "sha256:c4dc6a5c6ebbfd68d9f1335470f222ef7d6060bdeb3d134f43d4ec7343136db9"
  },
  "track": "DETERMINISTIC_TEST",
  "status": "PASS",
  "completeness": "COMPLETE",
  "executor": {
    "kind": "DETERMINISTIC_RUNNER",
    "principal_id": "prn_testrunner1",
    "runner_digest": "sha256:ef01161fa9a4556a945c93e6ad4962a8dfd663718c98c03ff786af6a0efd35cf",
    "run_receipt": {
      "id": "testrcpt_passdet001",
      "digest": "sha256:1dd46ea60548acd422695fa2d96ddaefca3cc62512c458350e6c2a788b90f3e8"
    }
  },
  "evidence_receipts": [
    {
      "id": "testrcpt_passdet001",
      "digest": "sha256:1dd46ea60548acd422695fa2d96ddaefca3cc62512c458350e6c2a788b90f3e8"
    }
  ],
  "evidence_facets": [
    "contract",
    "repo-sandbox"
  ],
  "terminal_reason_digest": null,
  "started_at": "2026-08-10T01:53:00Z",
  "completed_at": "2026-08-10T01:55:00Z",
  "authority_receipt_id": "arec_gatetrackpassdet000000",
  "immutable": true,
  "hash_rule": "jcs-rfc8785-v1+sha256(excluding:/gate_track_receipt_digest)",
  "gate_track_receipt_digest": "sha256:ef731f489c6b1963283bca00e02ecddfbb1d0ad0daada0e2401f29e1cbd14286"
}
